text,category,tags,difficulty
"5Gは第5世代移動通信システムの略称で、4Gと比較して高速・大容量、低遅延、多数同時接続という特徴があります。最大20Gbpsの通信速度、1ミリ秒以下の遅延により、自動運転、遠隔医療、VR/ARなどの新しいサービスが可能になります。",technology,"[""5G"",""通信"",""モバイル""]",intermediate
"サイバーセキュリティは、コンピュータシステムやネットワークを悪意のある攻撃から守るための技術と対策です。ファイアウォール、暗号化、侵入検知システム、セキュリティ教育などが含まれます。DXの進展とともに、その重要性はますます高まっています。",technology,"[""セキュリティ"",""ネットワーク"",""防御""]",advanced
"データサイエンスは、大量のデータから有用な情報や知識を抽出する学問分野です。統計学、機械学習、プログラミング、ドメイン知識を組み合わせて、ビジネスの意思決定や科学的発見をサポートします。PythonやRが主要なツールとして使われています。",technology,"[""データ"",""分析"",""統計""]",intermediate
"エッジコンピューティングは、データ処理をクラウドではなく、データが生成される場所（エッジ）の近くで行う技術です。IoTデバイスの増加に伴い、リアルタイム処理、帯域幅の節約、プライバシー保護の観点から注目されています。",technology,"[""エッジ"",""IoT"",""分散処理""]",advanced
"グリーンITは、情報技術の環境負荷を低減する取り組みです。省電力サーバー、仮想化技術、再生可能エネルギーの活用、電子廃棄物のリサイクルなどが含まれます。企業の社会的責任とコスト削減の両面から重要性が高まっています。",technology,"[""環境"",""省エネ"",""サステナブル""]",beginner